{
  "meta": {
    "updated": "2026-07-17",
    "verification_levels": {
      "source-reviewed": "Capabilities and license notes were checked against linked first-party sources.",
      "runtime-reproduced": "Maintainers reproduced a local run and recorded the environment.",
      "benchmark-reproduced": "Maintainers ran the published benchmark protocol and retained the output."
    }
  },
  "models": [
    {
      "id": "qwen3-tts",
      "name": "Qwen3-TTS",
      "organization": "Qwen",
      "summary": "A 0.6B and 1.7B model family for preset voices, three-second cloning, voice design, instruction control, and ten languages.",
      "tasks": ["tts", "voice-cloning", "voice-design"],
      "repo": "https://github.com/QwenLM/Qwen3-TTS",
      "model_card": "https://huggingface.co/collections/Qwen/qwen3-tts",
      "code_license": { "name": "Apache-2.0", "url": "https://github.com/QwenLM/Qwen3-TTS/blob/main/LICENSE" },
      "weights_license": { "name": "Apache-2.0", "url": "https://huggingface.co/collections/Qwen/qwen3-tts" },
      "license_note": "The released code and model cards use Apache-2.0. Check the exact checkpoint card before redistribution.",
      "commercial_use": "permissive",
      "languages": "10 major languages",
      "parameters": "0.6B / 1.7B",
      "streaming": "yes",
      "voice_cloning": "yes",
      "voice_design": "yes",
      "platforms": ["CUDA", "MLX"],
      "apple_support": "verified-runtime",
      "apple_evidence": "https://github.com/Blaizzy/mlx-audio",
      "status": "active",
      "hardware_class": "consumer-gpu",
      "verification": { "level": "source-reviewed", "checked": "2026-07-17", "sources": ["https://github.com/QwenLM/Qwen3-TTS", "https://github.com/Blaizzy/mlx-audio"] },
      "featured": true
    },
    {
      "id": "omnivoice",
      "name": "OmniVoice",
      "organization": "k2-fsa",
      "summary": "A compact multilingual TTS system focused on zero-shot cloning, voice design, and broad language coverage.",
      "tasks": ["tts", "voice-cloning", "voice-design"],
      "repo": "https://github.com/k2-fsa/OmniVoice",
      "model_card": "https://huggingface.co/k2-fsa/OmniVoice-0.6B",
      "code_license": { "name": "Apache-2.0", "url": "https://github.com/k2-fsa/OmniVoice/blob/main/LICENSE" },
      "weights_license": { "name": "Apache-2.0", "url": "https://huggingface.co/k2-fsa/OmniVoice-0.6B" },
      "license_note": "Apache-2.0 is stated for the released project. Voice inputs still require the speaker's permission.",
      "commercial_use": "permissive",
      "languages": "600+ reported",
      "parameters": "0.6B",
      "streaming": "no",
      "voice_cloning": "yes",
      "voice_design": "yes",
      "platforms": ["CUDA", "MPS"],
      "apple_support": "upstream",
      "apple_evidence": "https://github.com/k2-fsa/OmniVoice",
      "status": "active",
      "hardware_class": "consumer-gpu",
      "verification": { "level": "source-reviewed", "checked": "2026-07-17", "sources": ["https://github.com/k2-fsa/OmniVoice"] },
      "featured": true
    },
    {
      "id": "chatterbox",
      "name": "Chatterbox",
      "organization": "Resemble AI",
      "summary": "A family of expressive TTS models with zero-shot cloning, multilingual speech, and paralinguistic reaction tags.",
      "tasks": ["tts", "voice-cloning", "dialogue"],
      "repo": "https://github.com/resemble-ai/chatterbox",
      "model_card": "https://huggingface.co/ResembleAI/chatterbox",
      "code_license": { "name": "MIT", "url": "https://github.com/resemble-ai/chatterbox/blob/master/LICENSE" },
      "weights_license": { "name": "MIT", "url": "https://huggingface.co/ResembleAI/chatterbox" },
      "license_note": "The project and published checkpoints use MIT terms. Cloned voices require consent and lawful source audio.",
      "commercial_use": "permissive",
      "languages": "23 in multilingual model",
      "parameters": "350M / 500M",
      "streaming": "yes",
      "voice_cloning": "yes",
      "voice_design": "no",
      "platforms": ["CUDA", "MPS", "MLX"],
      "apple_support": "upstream",
      "apple_evidence": "https://github.com/resemble-ai/chatterbox",
      "status": "active",
      "hardware_class": "consumer-gpu",
      "verification": { "level": "source-reviewed", "checked": "2026-07-17", "sources": ["https://github.com/resemble-ai/chatterbox", "https://github.com/Blaizzy/mlx-audio"] },
      "featured": true
    },
    {
      "id": "kokoro-82m",
      "name": "Kokoro-82M",
      "organization": "hexgrad",
      "summary": "A small fixed-voice model with fast local inference, a broad runtime community, and no native voice cloning.",
      "tasks": ["tts"],
      "repo": "https://huggingface.co/hexgrad/Kokoro-82M",
      "model_card": "https://huggingface.co/hexgrad/Kokoro-82M",
      "code_license": { "name": "Apache-2.0", "url": "https://huggingface.co/hexgrad/Kokoro-82M" },
      "weights_license": { "name": "Apache-2.0", "url": "https://huggingface.co/hexgrad/Kokoro-82M" },
      "license_note": "The model card lists Apache-2.0. Voice packs are fixed voices, not zero-shot clones.",
      "commercial_use": "permissive",
      "languages": "8 language codes in v1.0",
      "parameters": "82M",
      "streaming": "yes",
      "voice_cloning": "no",
      "voice_design": "no",
      "platforms": ["CPU", "MLX", "Core ML", "ONNX"],
      "apple_support": "verified-runtime",
      "apple_evidence": "https://github.com/FluidInference/FluidAudio",
      "status": "mature",
      "hardware_class": "edge",
      "verification": { "level": "source-reviewed", "checked": "2026-07-17", "sources": ["https://huggingface.co/hexgrad/Kokoro-82M", "https://github.com/FluidInference/FluidAudio"] },
      "featured": true
    },
    {
      "id": "kitten-tts",
      "name": "KittenTTS",
      "organization": "KittenML",
      "summary": "An ultra-small CPU and ONNX TTS family designed for low-memory and edge deployments.",
      "tasks": ["tts"],
      "repo": "https://github.com/KittenML/KittenTTS",
      "model_card": "https://huggingface.co/KittenML",
      "code_license": { "name": "Apache-2.0", "url": "https://github.com/KittenML/KittenTTS/blob/main/LICENSE" },
      "weights_license": { "name": "Apache-2.0", "url": "https://huggingface.co/KittenML" },
      "license_note": "Apache-2.0 is stated for the project. Check individual voice and checkpoint cards before packaging them.",
      "commercial_use": "permissive",
      "languages": "English-focused releases",
      "parameters": "15M to 80M",
      "streaming": "yes",
      "voice_cloning": "no",
      "voice_design": "no",
      "platforms": ["CPU", "ONNX"],
      "apple_support": "upstream",
      "apple_evidence": "https://github.com/KittenML/KittenTTS",
      "status": "active",
      "hardware_class": "edge",
      "verification": { "level": "source-reviewed", "checked": "2026-07-17", "sources": ["https://github.com/KittenML/KittenTTS"] },
      "featured": true
    },
    {
      "id": "pocket-tts",
      "name": "Pocket TTS",
      "organization": "Kyutai",
      "summary": "A lightweight CPU-first TTS package with preset voices and zero-shot voice cloning from short reference audio.",
      "tasks": ["tts", "voice-cloning"],
      "repo": "https://github.com/kyutai-labs/pocket-tts",
      "model_card": "https://huggingface.co/kyutai/pocket-tts",
      "code_license": { "name": "MIT", "url": "https://github.com/kyutai-labs/pocket-tts/blob/main/LICENSE" },
      "weights_license": { "name": "CC-BY-4.0", "url": "https://huggingface.co/kyutai/pocket-tts" },
      "license_note": "The code uses MIT terms; the model card should be checked for attribution requirements on weights.",
      "commercial_use": "permissive",
      "languages": "English",
      "parameters": "100M class",
      "streaming": "yes",
      "voice_cloning": "yes",
      "voice_design": "no",
      "platforms": ["CPU"],
      "apple_support": "upstream",
      "apple_evidence": "https://github.com/kyutai-labs/pocket-tts",
      "status": "active",
      "hardware_class": "cpu",
      "verification": { "level": "source-reviewed", "checked": "2026-07-17", "sources": ["https://github.com/kyutai-labs/pocket-tts", "https://huggingface.co/kyutai/pocket-tts"] },
      "featured": true
    },
    {
      "id": "piper",
      "name": "Piper",
      "organization": "Open Home Foundation",
      "summary": "A fast local neural TTS engine with a large voice collection and practical CPU deployment.",
      "tasks": ["tts"],
      "repo": "https://github.com/OHF-Voice/piper1-gpl",
      "model_card": null,
      "code_license": { "name": "GPL-3.0", "url": "https://github.com/OHF-Voice/piper1-gpl/blob/main/COPYING" },
      "weights_license": { "name": "Varies by voice", "url": "https://github.com/OHF-Voice/piper1-gpl/blob/main/docs/VOICES.md" },
      "license_note": "The active engine is GPL-3.0. Every Piper voice has separate provenance and terms that must be checked.",
      "commercial_use": "conditional",
      "languages": "Voice-dependent",
      "parameters": "Voice-dependent",
      "streaming": "yes",
      "voice_cloning": "no",
      "voice_design": "no",
      "platforms": ["CPU", "ONNX"],
      "apple_support": "verified-runtime",
      "apple_evidence": "https://github.com/k2-fsa/sherpa-onnx",
      "status": "active",
      "hardware_class": "edge",
      "verification": { "level": "source-reviewed", "checked": "2026-07-17", "sources": ["https://github.com/OHF-Voice/piper1-gpl", "https://github.com/k2-fsa/sherpa-onnx"] },
      "featured": true
    },
    {
      "id": "f5-tts",
      "name": "F5-TTS",
      "organization": "SWivid",
      "summary": "A flow-matching TTS system used for zero-shot voice cloning and research on natural speech generation.",
      "tasks": ["tts", "voice-cloning"],
      "repo": "https://github.com/SWivid/F5-TTS",
      "model_card": "https://huggingface.co/SWivid/F5-TTS",